data,unidade,uti_ativos,uti_ocupacao,uti_percentual,enfermaria_ativos,enfermaria_ocupacao,enfermaria_ocupacao
2020-07-20, HOSPITAL DE FRATURAS DO CARIRI ,2,0, 0% ,9,4, 44.44% 
2020-07-20, HOSPITAL E MATERNIDADE SAO FRANCISCO DE ASSIS ,0,0, 0% ,34,29, 85.29% 
2020-07-20, HOSPITAL SAO RAIMUNDO ,5,5, 100% ,4,4, 100% 
2020-07-20, HOSP MATERN GERALDO L BOTELHO ,0,0, 0% ,2,2, 100% 
2020-07-20, HOSP MATERN LIA LOIOLA DE ALENCAR ,0,0, 0% ,6,2, 33.33% 
2020-07-20, HOSP MUNICIPAL DE JATI ,0,0, 0% ,7,0, 0% 
2020-07-20, HRC - HOSPITAL REGIONAL DO CARIRI ,89,77, 86.52% ,50,36, 72% 
2020-07-20, INCRI ,0,0, 0% ,16,0, 0% 
